name,description,duration,img
Manicura Spa con esmaltado,"Experimenta un lujo total con esta manicura que incluye corte, limado, tratamiento de cutículas, exfoliación, masaje relajante y un acabado impecable con esmalte de tu elección.",4,https://res.cloudinary.com/daowiromv/image/upload/v1715335505/LaMussa/2149171327_ppkcdt.jpg
Manicura Semipermanente,"Disfruta de uñas impecables durante semanas con este esmalte de larga duración, aplicado profesionalmente y curado con luz UV para un brillo duradero sin astillarse.",4,https://res.cloudinary.com/daowiromv/image/upload/v1715334824/LaMussa/manicuristapro_mplncd.jpg
Manicura Semipermanente con Nivelacion,Obtén un resultado perfectamente nivelado y duradero con esta manicura que incluye la aplicación de esmalte semipermanente junto con una nivelación experta de la superficie de la uña.,6,https://res.cloudinary.com/daowiromv/image/upload/v1715334824/LaMussa/manicuristapro_mplncd.jpg
Extensiones Gel X,"Consigue unas uñas largas y elegantes con las extensiones Gel X, esculpidas con precisión utilizando puntas preformadas y gel de alta calidad para un aspecto natural y duradero.",4,https://res.cloudinary.com/daowiromv/image/upload/v1715334824/LaMussa/manicuristapro_mplncd.jpg
Extensiones Gel sin Limado,"Añade longitud y resistencia a tus uñas sin dañar la superficie natural con estas extensiones de gel aplicadas sin limado, para un resultado seguro y sin preocupaciones.",4,https://res.cloudinary.com/daowiromv/image/upload/v1715334824/LaMussa/manicuristapro_mplncd.jpg
Extensiones PolyGel,"Experimenta la última innovación en extensiones de uñas con PolyGel, un material versátil que combina la durabilidad del acrílico con la facilidad de aplicación del gel, para unas uñas fuertes y hermosas.",4,https://res.cloudinary.com/daowiromv/image/upload/v1715334824/LaMussa/manicuristapro_mplncd.jpg
Pedicura Spa,"Date el placer de una experiencia relajante y rejuvenecedora para tus pies con esta pedicura que incluye remojo, eliminación de durezas, exfoliación, masaje y un acabado impecable con esmalte de uñas.",6,https://res.cloudinary.com/daowiromv/image/upload/v1715335652/LaMussa/pedicura_e7rkcd.jpg